{
  "$schema": "https://json-schema.org/draft/2020-12/schema",
  "type": "object",
  "properties": {
    "schemaVersion": {
      "type": "string",
      "const": "1.0.0"
    },
    "sourceCatalogRevision": {
      "type": "string",
      "minLength": 1
    },
    "sourceSnapshotHash": {
      "type": "string",
      "pattern": "^[a-f0-9]{64}$"
    },
    "sourceServerIdentity": {
      "type": "string",
      "minLength": 1
    },
    "actions": {
      "type": "array",
      "items": {
        "type": "object",
        "properties": {
          "actionId": {
            "type": "string",
            "minLength": 1
          },
          "method": {
            "type": "string",
            "minLength": 1
          },
          "normalizedPath": {
            "type": "string",
            "minLength": 1
          },
          "category": {
            "type": "string",
            "minLength": 1
          },
          "risk": {
            "type": "string",
            "const": "read"
          }
        },
        "required": [
          "actionId",
          "method",
          "normalizedPath",
          "category",
          "risk"
        ],
        "additionalProperties": false
      }
    }
  },
  "required": [
    "schemaVersion",
    "sourceCatalogRevision",
    "sourceSnapshotHash",
    "sourceServerIdentity",
    "actions"
  ],
  "additionalProperties": false
}
