{
  "schemaVersion": "1.0.0",
  "sourceCatalogRevision": "2026-07-28-public-read-review-3",
  "sourceSnapshotHash": "db58d1a1d286cfcae0f4f6aabd2c9aa10431177578e135f9585c7a0fff1fb2ca",
  "sourceServerIdentity": "reviewed-public-catalog",
  "actions": [
    {
      "actionId": "calendars-v3__get-appointment",
      "method": "GET",
      "normalizedPath": "/calendars/events/appointments/{eventId}",
      "category": "appointments",
      "risk": "read"
    },
    {
      "actionId": "calendars-v3__get-calendar-events",
      "method": "GET",
      "normalizedPath": "/calendars/events",
      "category": "appointments",
      "risk": "read"
    },
    {
      "actionId": "calendars-v3__get-calendars",
      "method": "GET",
      "normalizedPath": "/calendars/",
      "category": "appointments",
      "risk": "read"
    },
    {
      "actionId": "contacts-v3__get-appointments-for-contact",
      "method": "GET",
      "normalizedPath": "/contacts/{contactId}/appointments",
      "category": "appointments",
      "risk": "read"
    },
    {
      "actionId": "contacts.search",
      "method": "POST",
      "normalizedPath": "/contacts/search",
      "category": "contacts",
      "risk": "read"
    },
    {
      "actionId": "conversations-v3__export-messages-by-location",
      "method": "GET",
      "normalizedPath": "/conversations/messages/export",
      "category": "conversations",
      "risk": "read"
    },
    {
      "actionId": "conversations-v3__get-messages",
      "method": "GET",
      "normalizedPath": "/conversations/{conversationId}/messages",
      "category": "conversations",
      "risk": "read"
    },
    {
      "actionId": "conversations-v3__search-conversation",
      "method": "GET",
      "normalizedPath": "/conversations/search",
      "category": "conversations",
      "risk": "read"
    },
    {
      "actionId": "emails__fetch-template",
      "method": "GET",
      "normalizedPath": "/emails/builder",
      "category": "emails",
      "risk": "read"
    },
    {
      "actionId": "opportunities-v3__get-pipelines",
      "method": "GET",
      "normalizedPath": "/opportunities/pipelines",
      "category": "opportunities",
      "risk": "read"
    },
    {
      "actionId": "opportunities.list",
      "method": "GET",
      "normalizedPath": "/opportunities/search",
      "category": "opportunities",
      "risk": "read"
    },
    {
      "actionId": "payments-v3__list-orders",
      "method": "GET",
      "normalizedPath": "/payments/orders",
      "category": "payments",
      "risk": "read"
    },
    {
      "actionId": "payments-v3__list-transactions",
      "method": "GET",
      "normalizedPath": "/payments/transactions",
      "category": "payments",
      "risk": "read"
    }
  ]
}
